<?xml version="1.0" encoding="UTF-8"?>
<storici xmlns:xsi="http://www.w3.org/2001/XMLSchema-instance" ultimo_id="0" xsi:noNamespaceSchemaLocation="../../structures/storici.xsd">
  <storico id_utente="6">
    <progetti>
      <progetto titolo="titolo" id_progetto="5"/>
      <progetto titolo="titolo" id_progetto="6"/>
      <progetto titolo="rg" id_progetto="7"/>
    </progetti>
    <richieste/>
    <commenti>
      <commento id_commento="1">
        <testo>q3wf</testo>
      </commento>
      <commento id_commento="2">
        <testo>waEGR</testo>
      </commento>
      <commento id_commento="3">
        <testo>QWERF</testo>
      </commento>
      <commento id_commento="4">
        <testo>ARH</testo>
      </commento>
      <commento id_commento="5">
        <testo>r3f</testo>
      </commento>
      <commento id_commento="6">
        <testo>warg</testo>
      </commento>
      <commento id_commento="7">
        <testo>AEF</testo>
      </commento>
      <commento id_commento="8">
        <testo>agwe</testo>
      </commento>
      <commento id_commento="9">
        <testo>ew5yh</testo>
      </commento>
      <commento id_commento="10">
        <testo>eh5</testo>
      </commento>
      <commento id_commento="11">
        <testo>w3r</testo>
      </commento>
      <commento id_commento="12">
        <testo>4qwt</testo>
      </commento>
    </commenti>
    <valutazioni_progetti/>
    <reports_progetti/>
    <reports_commenti/>
    <discussioni>
      <discussione id_discussione="2" titolo="tits prog 5"/>
      <discussione id_discussione="3" titolo="tits prog 5"/>
      <discussione id_discussione="4" titolo="23"/>
      <discussione id_discussione="5" titolo="QWd"/>
    </discussioni>
    <valutazioni_commenti/>
  </storico>
</storici>
